comment_er,level,comment_time,caption,content,support,object,feedback
星空,力荐,2021-10-19 13:11:47,人性的光辉与黑暗,最近这部《鱿鱼游戏》非常火爆，观看之后发现确实有它的过人之处。大逃杀类型的作品本身就仍然非常火爆，各种延伸的影视剧和游戏一浪高过一浪，这部剧仍然能够突出重围做到了以下几点。1、创意：利用简单易懂的小孩子玩得游戏加上血腥的杀戮形成极大的反差，让你不停地想知道,,,0回应
文渣·DRIVE,力荐,2021-10-19 04:31:56,鱿鱼游戏——————或许你能逃得过,鱿鱼游戏——————或许你能逃得过几年前韩国人用《寄生虫》告诉世界，有钱人是什么。今年，韩国人再次带着无限的热情和诚意，告诉世界，如何成为有钱人：《鱿鱼游戏》—————我们谁也逃不过。男主的身世背景，故事线路并不复杂，这个谁都能看懂。难点在围绕男主出现的,1,,4回应
lulu,还行,2021-10-19 10:01:50,商业浮世绘,看完了鱿鱼游戏主要剧情（剧透警告）：一个老头闲得无聊想搞点事情让自己乐呵但是自己太有钱一般的事情满足不了就想玩刺激的杀人游戏找了几个志同道合的上流社会基友，观众有了需要玩家，就把目标放在了社会上的赌博和破产的落魄人群，使用金钱攻击，成功俘获为了金钱,,,0回应
扶舟先生,推荐,2021-10-19 09:46:03,可以置换但不影响设定和剧情发展的几个地方,一、6个游戏的顺序问题。第一个为“一二三木头人”，这个没问题，一开始的目的就是要死很多人，扣糖饼的位置靠前靠后一位都是可以的。玻璃桥那关，人已经基本上崩溃了，按照一般人性逻辑，后来的基本上就是“鬣狗掏肛”，任人宰割了，完全失去自我意识。二、第六关存在的必,,,0回应
juan,暂无评价,2021-10-19 02:19:37,结局烂尾,主角真的是得了便宜还卖乖，他一个人得到那么多钱，把那两个临终前托付他的事办好了，把自己赌债还了，过上好日子。最后一集他一个人能改变什么，那些人拥有无限的财产与权利，岂是他能动摇的。善良愚蠢的有些过头的，主角光环太严重了，就他这样能生存到最后纯粹是运,,,0回应
Kuroko+,还行,2021-10-19 01:11:52,人气与内容严重不符的商业片制作,花了我人生宝贵的时间看了鱿鱼游戏她到底花了多少钱营销啊。就这？就这？就这？作为一个合格的商业大逃杀作品，看个乐呵就可以了，非得拿配不上的内容去冲高水平的流量，看了看剧情，是隔壁樱花国玩10多年玩剩下的。实在是没什么内容心意的拼贴怪，换汤不换药。剧情的猎奇,1,,0回应
王不曰,暂无评价,2021-10-18 17:03:12,儿童游戏成人规则,看完《鱿鱼游戏》，该剧给我的第一印象就是短小精悍。在快速的生活节奏下，相比动辄2小时的电影，这更贴心。该剧挺简单。情节简单，讲的就是一出游戏闯关。游戏简单，主人公儿时玩过的游戏，有些我们也玩过。规则简单，胜一局进下一局，最终胜利者获得高额奖金。该剧不简单。,,,0回应
曼佳,推荐,2021-10-17 23:08:20,韩剧《鱿鱼游戏》：在游戏中运气和实力的双重博弈,文/曼佳最近很热门的韩剧《鱿鱼游戏》一口气看完了，剧情大概是：一群在现实生活中负债累累已经无法喘息的人，获得一个机会，进入一个神奇的地方，据说玩赢了游戏可以获得大额奖金，这笔奖金不仅仅能轻松还掉以前的所有的债务，还能剩余非常大的数量能让人过上非常富裕的生活,,,0回应
美少女珊,还行,2021-10-18 15:42:45,探究男主巨婴视角以及对北美病夫们的讽刺,网飞最近爆火的《鱿鱼游戏》看了有点停不下来，大逃杀类网剧。“一二三木头人”那里将童年.游戏.娃娃跟紧张刺激血腥等暗黑因素结合一起，感官上非常舒适，但是后面有些高开低走，主要是男主塑造的太过膈应，又当又立。但剧中还是有两个配角塑造的挺好。第一个是韩大妈，虽然是,,,0回应
DDDougunut🍩,暂无评价,2021-10-18 15:42:24,《鱿鱼游戏》观后感 剧透较多,我总是把它叫成鲸鱼游戏。。。记错鱼名了，估计觉得鲸鱼比鱿鱼杀伤力大吧。男主赌徒的心理是他参与这个游戏不可缺少的要素。同样，其他的454名人员也是或有着相同心理、或由于社会因素，在各自的生命中走投无路又不想认输的人。而剧中大boss则是站在用钱堆砌的视角，用人性的,,,0回应
riverpassing,推荐,2021-10-15 20:58:43,不过是《地球OL》的限制级DLC罢了,Netfilx最近又疯了。不过感觉Netflix在大肆扩张的今天，也没有想到一部韩剧能火成这样。短短几天，鱿鱼游戏的收视率已经超越了Netflix一众台柱，从《纸牌屋（可惜下木大人GG后烂尾》到《王冠（话说下一季都该写到现代了，皇室不会发飙吗。）》，甚至在美帝本土都登上了榜首。,2,,0回应
Sun,还行,2021-10-16 12:26:19,被吵起来的“鱿鱼” 与资本的游戏,主题：人性对象：456名穷困潦倒，负债累累的三教九流方式：6场游戏1.123木头人2.抠糖饼3.拔河4.猜玻璃球5.玻璃桥6.鱿鱼游戏分集：1.123木头人2.地狱3.撑伞的男人4.即使被困住也要选边站5.平等的世界6.钢布7.贵宾们8.代表人物9.幸运之日主线,,,0回应
糊胡涂,力荐,2021-10-16 20:43:30,鱿鱼游戏——人生为什么总是那么无趣,“无论穷人还是富人的共同点就是，人生毫无乐趣可言”垂死之际的韩一男说的这句话着实把我治郁了。鱿鱼游戏自从9月17日在网飞上线后在全球范围内火爆播出，当我跟风一起看这部剧的时候已经是十月份了，网飞也是针对这部剧做了大力气宣传，网上经常能看到那个形态诡异的机械巨,1,,0回应
三疊紀,推荐,2021-10-17 00:30:38,人性永遠是經不起推敲的,最近爆火的網飛劇集，趁著週末一連刷了全片，觀感真的太爽太刺激了，前期一點也不拖泥帶水，第一集直接進入正題玩遊戲射殺兩百多人，死去的每一個人都是一億獎金，只有活到最後的人才能拿走累積的所有獎金，這是一場以血和淚來進行交易的遊戲。人類在面臨巨大的威脅面前會本能,,,0回应
Sun,还行,2021-10-16 17:03:47,被炒起来的鱿鱼与资本的游戏,据说是登上70多个国家的热门榜单的“鱿鱼游戏”终于看完了。以韩国电影电视工作的发达程度，拍出这样的水准应该是情理之中，再加上有网飞大佬的加持，轻轻松松就被炒起来了。电视剧同款的文创服饰也成了热门，这也就是一场资本的游戏。按照剧情的发展，应该会出第二季，可以以,,,0回应
D野千寻,力荐,2021-10-16 18:10:44,分集短评,E1一二三木头人开场上规则，主角背景介绍人物铺垫完平滑过渡游戏实战，温柔的经典华尔兹舞曲配升格血腥画面的招数这里用得也蛮合适，只是无法直视的歌又多了一首最近很爱的《flymetothemoon》。E2地狱我觉得1号会投继续，第一个游戏只有他是抱着玩游戏的心态在玩，没有,2,,0回应
苏泊云,暂无评价,2021-10-16 18:14:38,理解了投机者的逻辑，就能理解男主所有被诟病的选择,看评论对男主的声讨主要在于对待母亲和女儿上，最大的争议有三点：1）抛下病重母亲重返游戏，回来母亲已经孤独死去，是不是极不孝；2）不接受女儿继父给母亲的救命钱，反而打人家，是不是极不理智；3）你对自己母亲尚且如此，有什么资格指责推人致死的男二，是不是极虚伪。说,1,,0回应
烤焦的面包,力荐,2021-10-16 17:37:49,不谈人性，只谈人物,你永远赚不到超出你认识范围外的钱，当一个人的财富大于自己认知的时候，这个社会有100种方法收割你，直到你的认知和财富相匹配为止。在最近的聚会中我向哥们推荐了这部爆款剧，他问我是不是棒子拍的（因为他知道我是极端的辱法辱韩），我说是，但是如果这部剧是有456名韩国人,,,0回应
林深知鹿,推荐,2021-10-16 00:22:08,《鱿鱼游戏》：全员恶人、丧到极致、人设崩坏，爆火的“网红”剧,《鱿鱼游戏》：全员恶人、丧到极致、人设崩坏，爆火的“网红”剧没有人可以拒绝孔刘的邀请。李政宰孔刘李秉宪，就这个阵容，他们几个人就算只是干坐在那一整天，啥也不做都好看。女主酷、冷、飒、拽、A（郑浩妍凭借该角色一周增粉1700万，成为LV代言人）这个十一假期，《鱿,2,,0回应
我一直觉得,推荐,2021-10-18 14:56:03,符号世界 + 爽剧,《鱿鱼游戏》主要故事情节是这样的：一群负债累累的人有一天受到邀请去参加一个游戏，通过了全部关卡的人，可以赢得巨额奖金，456亿韩元，数额之大，不仅可以还清债务翻身做主人，而且足够几辈子衣食无忧。赌吗？【符号世界，尖锐深刻】大逃杀主题的剧比如《饥饿游戏》，《弥,,,0回应
Micheal,推荐,2021-10-18 13:11:53,韩剧+网飞＝高知名度,近二十年来，韩国的影视剧产业迅猛发展，终于在这一部达到了登峰造极的程度。《鱿鱼游戏》并不是质量最高的韩剧，但它在各方面都做到了平衡，一二三木头人等六种简单的儿童游戏不需要在剧中过多科普，简单的游戏设置不需要过多烧脑，对路人极其友好。其次就是对于游戏中人性黑,,,0回应
遥雪暗香苦寒来,暂无评价,2021-10-18 12:36:23,绝路搏命,转《鱿鱼游戏》是一部在大逃杀背景下集合智斗、冒险、惊悚、悬疑等元素的韩剧，有点类似于《诈欺游戏》、《赌博默示录》、《动物世界》等影视剧，都是将一群人集中到一个生死存亡的游戏中，赢了生，输了死。而在游戏设计方面，《鱿鱼游戏》的设计可以用“幼稚”二字来形容，因,,,0回应
祺祥如意袅,推荐,2021-10-16 16:02:52,这场游戏，你觉得有趣吗,（内含微微微量剧透，不过约等于没剧透）用通勤和午休的时间五天看完了。开头真的让我大为震撼！心脏怦怦跳，要时不时捂住屏幕才看得下去。故事其实还是那么一个存活类的经典故事，有前因后果，反转，团结，离间，信任与失去，该有的元素都有，完成度比较高。编剧的故事元,,,0回应
情画,暂无评价,2021-10-18 10:59:15,《鱿鱼游戏》的温柔,《鱿鱼游戏》是更残酷现实社会！所有人舍弃已有的社会关系，在一个不会挨饿受冻的社会缩影里玩丛林法则游戏！导演选择两种最能考验人性的东西作为奖励！钱和生，人在面对钱财和生死的时候利己才会最大程度地展现！太温和的惩罚不足以暴露人性，剧中我最喜欢的游戏是玩弹珠，仿,,,0回应
晚风揽月,还行,2021-10-18 10:43:38,高开低走，没有跳出套路,早就听说这个剧很牛，到处都在宣传，我就索性看一看。虽然看韩剧不多，一向对韩剧是又爱又恨。爱是喜欢韩剧或者韩国电影有很多确实不错的，敢拍，拍的也到位。比如《熔炉》《釜山行》之流，看着还挺有意思的。不喜欢韩剧是不喜欢他们的表演方式，喜欢撅着嘴，瞪着眼，动不动就,,,0回应
怪力乱神,暂无评价,2021-10-18 10:37:03,脑洞另一个版本,我觉得这个剧是一个很好的胚子，但从许多方面来说可以更好，它可以拆解和延展的东西非常多，再从几个方面延伸，可能会深更丰富。比如，开头是警察局堆积了大量无法破解的失踪案，然后从某个线索发现了背后一个共同的秘密，沿着这个线索追踪，一个警察作为player潜入其中，从最,1,,0回应
阿呆,推荐,2021-10-17 19:39:32,照这个进度发展，生存游戏指日可待,《鱿鱼游戏》的火爆程度和影片故事的简单之间有种被游戏刺激和人性考验完全遮掩的违和感，而如此简单的游戏，似乎更加凸显了人类欲望的原始。ONE游戏本身生存游戏实在不是新鲜话题，尤其去年年底《弥留之国的爱丽丝》漫改日剧第一季才在豆瓣杀出8.0分，其实对比而言，《鱿鱼,1,,0回应
豆友219924010,暂无评价,2021-10-18 00:55:09,前八集封神！！！结局垃圾！！！,有两个类型的影视作品，一种叫做逆转结局式影视，这种作品前面如温吞水般或者毫无波澜，但是结尾却惊天逆转使得影片升华为经典作品，如《迷雾》，《心理游戏》；还有一种称为烂尾式结局影视，如前两年日本鬼子的《轮到你了》，到如今号称全球最火的奈飞棒子神剧《鱿鱼游戏》。,,,0回应
自然卷,推荐,2021-10-18 00:26:53,活到最后已经不是人了,《鱿鱼游戏》--活到最后的已经不是人了这是最近最火的影视作品了吧，网上铺天盖地的讨论，之前有博主说这个剧太假了，按照韩国人口收入，对比我国也就是5000万人民币，谁愿意杀400人活到最后呀。拜托，正常人给多少钱都不应该杀人呀，但是走投无路，亡命之徒别说5000万了，5万,,,0回应
大柠檬,推荐,2021-10-17 23:56:19,不够变态（和一点反省）,我想写点反省，和这部剧仅一点点的关系，后面再谈谈观后感。我是在这部剧刚开始火的时候就知道了，不止我知道，很多人还给我推荐了，但我没看。理由很简单，我只瞄了眼简介，就可以脑补出整部剧的情节。实在太相似了，一样的设定，一定的结局，一样的“敬请期待第二季”。,,,0回应
闲柠檬,还行,2021-10-17 23:47:44,不公平的鱿鱼游戏：001号的隐喻,谁才能拥有001号的工牌？传说中JACKMA就是阿里巴巴的001号员工，现实中我们也不乏工号序列象征着权力的道听途说或者经验。总之，001号对于其所在组织来说绝对是规则制定者之一，而非普通的“游戏”参与者，正如近日火出圈的《鱿鱼游戏》中的001号参与者，就是一位隐藏身份到最,1,,0回应
贝壳七,还行,2021-10-17 23:10:02,没有绝对的善 但有绝对的恶,周末两天连续着刷了这部剧，剧情连贯性比较紧凑，剧情的不确定能让人跟着看下来。更多的情节设计我认为是与人性相关的，但是我又觉得很矛盾。从结局倒退来说，456号设立的是仿佛正义善良的人设，他对整个游戏的是不理解和愤怒的，他问:你们为什么要这样做？对于这点来说，我不,,,0回应
一棵松,还行,2021-10-17 23:01:13,人类总体命运是否也是赌徒心态决定？是要可持续发展，还是要无限繁殖不加控制地不可持续发展？,1赛马彩票本质上也是一种赌博，公司肯定是按赔率最小的方案来操纵骑手控制他们的成绩。高利贷害死人。有点像宫斗剧。2要钱还是要命？赌徒的心态使他们负债累累，也使他们肯用命来换钱。人类总体命运是否也是赌徒心态决定？是要可持续发展，还是要无限繁殖不加控制地不可,,,0回应
罗伊德loyd,力荐,2021-10-17 22:29:59,［剧透］第一集就猜到幕后boss了,以下内容有剧透我真是太聪明了。鱿鱼游戏第一集，我就猜到幕后大boss就是001号[嘻嘻]。首先第一感觉这么老的人来参赛不太正常啊，而且001号说明是最早知道并参加这个比赛，会不会是前几届就来参赛并一直在这里呆着？后续几个线索又加剧了我的判断：1.木头人游戏，在有人死亡,1,,0回应
Evan,推荐,2021-10-17 21:26:42,观感,李政宰的演技有颠覆到我我对他的认知还仅仅停留在新世界里的角色这部剧很好的表达了人性的丑恶及黑暗面弱肉强食优胜劣汰适者生存的世界就必须要做出选择与代价结尾有些仓促可能男一是要再一次参加游戏吧揭露出这些游戏策划者的丑恶总之导演立意仍然立足于人性拍摄的,,,0回应
沉璧,暂无评价,2021-10-17 21:13:28,我想分析下《鱿鱼游戏》里的曹尚佑,我觉得，鱿鱼游戏里，曹尚佑的人设是最立体的一个，也是最能体现人性（主要是恶的一面）的复杂的。1.曹尚佑是以第一名的成绩考进首尔大学经管系的。从他出身来看，单亲家庭，和妈妈相依为命，妈妈只是经营海鲜铺子的，并不富裕。这就意味着他不可能走捷径进入韩国第一等高校，,1,,4回应
小鱼仙儿,力荐,2021-10-17 20:41:48,人之初，性本善,[cp]资本家最擅长利用人性。剧最后一集点明了主旨。老头是幕后策划人，老头说有钱人和没钱人的共同点就是人生没有了乐趣，多么讽刺的社会现实。这场狂欢，只是一场有钱人的游戏而已。最可怕的是，剧中除了穷人和富人，电视剧前面的你我竟也在观看者他们的血战。原来看客也参与,,,0回应
hoshikune,还行,2021-10-17 17:24:26,被高估的逃生游戏,剧的问题还是蛮多的，一一道来。1，节奏很慢。其实我只是想看他们玩游戏，关于他们为什么要来、为什么不得不回去完全没必要交代那么多…而且中途角色们甚至还退出游戏了好几天，感觉没必要加这一段，或者说没必要用这么多篇幅描写……明明有更简单的方式让游戏者意识到“出去,,,0回应
蔡文淼,还行,2021-10-17 15:42:27,高高在上的VIP看客也并非人生赢家; 贫穷与富有从来不是衡量幸福的唯一标准,第6集直接哭成狗。曹尚佑的智商一直是在线的，弹珠游戏一开始很多人都以为会像拔河游戏一样两人组会是协作关系，但他猜到这一次的队友关系相杀的概率大过协作，所以他首先避开了奇勋，因为456人当中，他最不愿意伤害的人就是奇勋。阿里不管作为友方还是敌方都是不错的选择，所,1,,0回应
豆友六一居士,推荐,2021-10-17 15:08:36,金钱折射人性的丑恶,忍不住看了一下最近比较火的鱿鱼游戏，怎么说呢，《电锯惊魂》+《饥饿游戏》+《大逃杀》吧，不能算是抄袭吧，证明了这样的题材虽然老套却很合观众胃口，毕竟现在的生活和平中带着动荡，金钱至上以及人性的逐步泯灭也是存在的，时长隐喻一下暗讽一下也是需要的。棒子暴力浮夸的,,,0回应
韩陌暖,推荐,2021-10-17 14:05:12,牛逼呀。就有点恐怖吧。,就是看到第1集的那个123木头人。然后那个娃娃就很恐怖。然后呢，正常人都是整个身体转过来，他是头转过来。然后呢，他的那个声音也很恐怖。嗯，正常人都是用小的人。他是用那种巨大的那种人。就是他转过来的时候那个眼睛会红一下。然后感觉就有摄像头一样的。这个就很牛逼。好,1,,0回应
汪星金毛,推荐,2021-10-17 12:47:51,警察弟弟和游戏负责人哥哥的故事推测,很喜欢这个沉默系的帅气警察弟弟，第一季中他作为唯一一个和游戏无关的局外人戏份不多，但是个揭露秘密推动情节发展的关键角色，结局他被游戏负责人哥哥击中，肩膀中枪掉入大海，但应该并没有死捋一捋第一季的情节，对这两兄弟的故事做一个总结和推测：哥哥之前也是警察，这,3,,2回应
Zoe,暂无评价,2021-10-17 11:15:47,鱿鱼游戏,刚刚把最后一集看完了，还以为没更完，特地来查了一下，9集🤦🏻‍♀️……感觉没讲完，警察最后死了吗，男主再次返回的后续也没讲完…….但内容还是很不错的，每个环节都展露了人性的种种，生存本能、贪欲……相较而言男主可以说是非常善良了，不晓得这点与男主现实中,,,0回应
Lorgar,力荐,2021-10-17 10:59:54,所以说成立一个组织最重要的还是资金,我忙里偷闲的把电视剧看完了，所以说很明显，一个组织最重要的来源还是资金。组织的创始人就是资本大佬，结合其他资本家来给整个游戏提供资金，没有资金寸步难行。通过血腥残忍的游戏给富有资源者提供娱乐，从而获得每年源源不断的流入资金。这样看来一个组织的成立关键80%可,,,0回应
忘路之远近,还行,2021-10-17 09:22:35,资本异化无限流,三星半，今年开始在豆瓣记录以来的第一百部影视剧，随笔记录成长吧。主题涵盖资本，童年，死亡，第一感觉便是异化。统治者是最深度异化的人，对他们来说，资本等于生命，一个人就是一亿韩元，他们所言平等更像是“死亡面前，人人平等”，他们利用各种生死困境，逐渐让玩家泯灭,,,0回应
星月,暂无评价,2021-10-17 09:18:58,游戏啊，游戏而已,如果你不懂大家为什么参加游戏，愿你永远无需懂；如果你不懂游戏中为什么大部分人都死了还要继续游戏，愿你永远无需懂；如果你不懂主角为什么有钱不花，没有登上去美国看女儿的航班，愿你永远无需懂；你问我懂什么，我多了解了几个游戏的规则啊，了解到原来中韩小朋友的游戏,1,,0回应
绿酱,推荐,2021-10-17 06:21:00,残暴的人性试探,几乎一口气看完，胡乱说几句观后感（带剧透，慎阅）。我觉得可以给3🌟半或者4🌟。剧情是紧凑的，但确实让我想起了《饥饿游戏》、《艾尔酒吧》之类的片子。我看了一部分本剧导演采访，似乎是在08年左右酝酿的剧本，怎么说呢，也不一定说是模仿，毕竟大逃生题材确实很火，而,,,0回应
西部往事杨百亿,力荐,2021-10-17 01:23:38,现实注解,好像每部能给人留下深刻印象的韩剧韩影都会有手足相残，兄弟阋墙的桥段，无他，七十多年前就在胜利的曙光到来之际，远在天边的那场秘密会议上，三个巨头就已经把这个一直都是完整国家的命运决定好了主角是什么人？他曾是一名参加罢工的汽车工人，这件事是真实存在的，当年他们,,,0回应
酢乙女嫒.,推荐,2021-10-17 00:07:53,当你想走出来的时候，早已深陷其中。,借由韩国的影片来泄他国的欲以及权力至上的人的糜烂行为。相当讽刺的一部韩剧，没有什么情情爱爱，只有无尽的厮杀，以及人性的贪婪与扭曲。当时看到开头，脑子第一想法就是，这场游戏在暗中一定有人当成乐子围观，要么是位高权重之人，要么是富埒王侯之人。这是有钱人包来的,,,0回应
小牛_xb,暂无评价,2021-10-17 00:02:03,鱿鱼游戏——一场自我剖析,这不是一篇纯正的影评，因为我没有完整地看完剧集，只看了大概50分钟的解说。就从人性的角度来探讨一下这部剧。一、两种投射看这部剧的时候，我将自己带入了两种角色中。（1）金面具：第一个游戏开始，当那个诡异的木头人转身杀死第一个人时，我的内心竟然有一丝暗爽。接着,,,0回应
March_Robin,推荐,2021-10-16 23:08:18,无题,抛去懒得吐槽的槽点，7分吧。很带劲。我的看剧目的怎么就和大老板一样，只是为了乐趣。你在底下拿命搏，观众席上的资本家津津乐道完全不在乎。再一个，友邻说得对啊，看完这剧只能感受到东亚人真的太卷了，卷得匪夷所思。躲过了各种外部淘汰，却躲不过人民群众之间的内斗互害,2,,4回应
赤羽营主帅,暂无评价,2021-10-16 22:11:40,虽然结局是结局，但你就是猜出来了也不敢信,分析隐喻和游戏啥的，都是瓣友的爆梗了，所以就随便说点别的吧。当我决定写剧评时最想打出来的字。虽然一开始就觉得男一肯定走到最后的人啊！但是，随着一段段小剧情结局猜错的情况越来越多，就开始怀疑男一应该也可能不是走到最后的人。甚至到了倒数第二集，就剩主角团三个人,,,0回应
老婷很方,力荐,2021-10-16 20:24:45,是人？是兽？,游戏设定、发展真的能引起很大反思。主角脱离游戏后迟迟无法恢复心情，回复现实社会，观者也一样。整场游戏，幕后金主出钱，招募一群社会底层挣扎的人，开启这场看似“公平”其实又不公平的“赛马”游戏。管理者口口声声强调公平，其实圆形、三角形、正方形、管理者，这种潜,,,0回应
LTSingle,暂无评价,2021-10-16 20:23:21,20211016鱿鱼游戏,1、用一个周六下午的时间，刷完9集。2、总的来说并没有什么特别创新的地方。这类大逃杀影视作品，好莱坞已经有很多。3、当作爽剧来看还是不错的。悬疑刺激暴力血腥，应有尽有。人物角色的表达，基本在线。4、有些游戏关卡选得不好。比如戳糖形，缺乏互动，很无聊。比如最后,,,0回应
欧宁,暂无评价,2021-10-16 20:07:15,啥时候来个密室逃脱版？,建议国内版叫跳房子，第一关独木桥长距离滚铁环，限定时间没完成被淘汰。第二关分组骑马打仗，没打过的被淘汰。第三关老鹰抓小鸡，限定时间被抓到淘汰。第四关挑冰棍，限定时间失败被淘汰。第五关丢沙包，被砸中者淘汰。第六关回到跳房子，限定时间没通过淘汰。说白了是一个从,,,0回应
