comment_er,level,comment_time,caption,content,support,object,feedback
沙丁魚罐頭,推荐,2021-09-29 16:07:57,一点点感想,1、关于整部剧虽然整部剧有高开低走的趋势，但胜在观感十分地好，视觉效果啊，配乐啊，还有演员的表演啊，都十分精彩，没有拉垮的。美中不足的是剧情上的一点硬伤。比如警察那条线。警察进入这个组织的时候太过轻易，中途获取信息也很容易，结尾死的时候更是无意。其实我一,,,2回应
彳亍,力荐,2021-09-29 14:48:45,谁是这场游戏的万恶之源,如剧名所说，这是一场游戏，不同的是，游戏的玩家是活生生的人，撕掉那些边缘人的标签，除了个别穷凶极恶的亡命之徒外，很多人都是被生活所逼，才抱着赌徒心理上了这艘贼船。他们只有一次机会，这就意味着他们不能重来（1号除外）。所以这给了他们恐慌、畏惧、乃至人性的扭曲,,,0回应
赞boomboom,暂无评价,2021-09-29 00:15:03,爽剧够了，神剧不足,同类的“在极限处境中暴露人性”的电影电视剧太多了，套路都是同类中见惯了的：团队作战和自相残杀的博弈，好人的黑化，大权力结构中的微型权力结构（医生和买卖器官的士兵）善良成为赢家…还有就是结尾仍然是简单的黑白对垒：当老爷子说出组织游戏的原因就是为了解闷，故事有,,,0回应
tt要一直开心鸭,还行,2021-09-29 15:17:54,前八集八分，最后一集四分。,烂尾，一直很期待的结局就这？前八集8分，最后一集四分。非得加一个警察的元素，结果最后警察没了，死之前给组长打的电话一点用没有，无人追查。九几年开始，20多年了，每年同一时间消失400多人，都没人管，信息如此发达的今天，民间一点舆论都没有？还不如就当是一场梦，醒来,,1,1回应
OneTwoFree,推荐,2021-09-29 15:12:14,游戏中的人性,一口气刷完的剧不多这个剧本感觉很熟悉，国内的动物世界，动物世界原版日本的赌博默示录，都是被生活逼到绝境，想要参加游戏翻身。当年第一次看动物世界的时候，觉得编剧真牛逼，游戏不算特别烧脑，但是考验了智商、情商、人性。还有一个韩国综艺游戏的法则也很类似，不过很烧,,,0回应
豆糕（无畏跑路,推荐,2021-09-27 22:23:43,鱿鱼游戏,在看剧之前先看过一些对男主是否伪善的讨论，所以看剧的时候也有意通过男主的行为判断他究竟是伪善还是真的善良，个人认为男主成奇勋并不是一个伪善的人，他的善良就是真实的善良。虽然他确实是一个失败的烂人，赌博、鬼混、无能却又有着极强的自尊，他把女儿的继父给他的钱摔,,,0回应
华莱士人鱼,推荐,2021-09-28 22:33:20,我活在一个梦里,世界不该这样的有钱人不该以贫穷的人取乐更让人绝望的是贫穷的人竟然心甘情愿被拿来游戏只为了钱世界法则本就如此吧从来都是金钱的交易可不该这样的被游戏的明明是活生生的人啊他被母亲带到这个世界他第一次睁开眼睛审视这光怪陆离的世界去经历人生中的一次次转折,1,,1回应
千年萧萧,力荐,2021-09-27 09:54:26,鱿鱼游戏！ 附个人理解、大量剧透，拔河诀窍......,《鱿鱼游戏》是由Netflix出品，Netflix出品不必多说，大部分都是精品，极少翻车，另外已经官方说了，肯定要出续集，期待期待！一共6集，每集差不多1个小时，除去第8集，第八集才30多分钟1一二三，木头人2地狱3撑伞的男人4即使被困住也要选边站5平等的世界6刚布7,,,0回应
帝国之主,还行,2021-09-29 13:53:01,怪不得连8分都上不去,原来是有原因的。这么狠的题材剧中部分不合理的细节就不说了，最后这是要干啥？刚正面？都TM讲人性了最后来一个刚正面？都TM死了那么多人了活着不好吗？最后他一个电话过去要继续参加下一期，或者当下注的或者当组织者整部剧都至少8.5以上。7.8都高了，烂尾烂碎了。剧里面有句,,1,0回应
朴斯万,推荐,2021-09-29 13:43:07,屏幕背后的我们像VIP们一样看着这出人性之戏,豆瓣上博学多才，学富五车的人才云集，他们是不屑于看《鱿鱼游戏》这样的韩剧呢，还是不屑于写一个深刻且引人入胜精彩影评呢？豆瓣上评分较高的前几个影评并没有让我读的眉飞色舞，拍案叫绝。于是想着写篇浅见。毫无疑问首先这部韩剧是一部爽片。韩国的哲学家姜信珠说；分别通,,,0回应
韩宝薯条🍟,暂无评价,2021-09-29 12:54:43,为什么会这么火？不懂,不知道为什么这部剧这么火，主角演技可以，就是剧情很一般，没有让人很想看下去的冲动，来豆瓣看了下评分差不多，其他地方都尬吹，对于生存类的剧我可能都比较无感，还是看弹幕剧透太多了没有一点惊喜，就是游戏然后死人，就这？不至于很难看就是铺天盖地的说太好看了以免有点,,,4回应
王胖子,暂无评价,2021-09-29 12:41:40,剧评《鱿鱼游戏》,剧评《鱿鱼游戏》先说说这部剧的阵容！导演黄东赫，OK说名字不认识那就说作品《熔炉》（这个算是童年阴影了）！《重返二十岁》（看过挺好笑的）！是一位作品少但是高质量的导演。主角李政宰OK又不知道谁是吧韩国高质量阿加西之一主演过《新世界》（好看！）《与神同行》,,,0回应
王胖子,暂无评价,2021-09-29 12:41:33,剧评《鱿鱼游戏》,剧评《鱿鱼游戏》先说说这部剧的阵容！导演黄东赫，OK说名字不认识那就说作品《熔炉》（这个算是童年阴影了）！《重返二十岁》（看过挺好笑的）！是一位作品少但是高质量的导演。主角李政宰OK又不知道谁是吧韩国高质量阿加西之一主演过《新世界》（好看！）《与神同行》,,,0回应
Feixiang,推荐,2021-09-29 12:22:09,流媒史上最成功的韩剧，是如何炼成的？,不止是爽剧的爽剧“无脑爽剧”，“漏洞百出”，“圣母烂尾”,2,1,0回应
桔汁小馄饨,推荐,2021-09-29 08:07:47,分析尚佑的结局&剧情与耶稣的关系，为什么是456个人？,网上各路大神把细节都抠得差不多了，就写一些不重复的：自己喜欢的情节以及还没被广泛讨论过的话题。开始看《鱿鱼游戏》的时候，就觉得这明明是韩国版的《弥留之国的爱丽丝》嘛！生存游戏人性百态+典型韩剧的戏剧张力（抓马感）。看完其实觉得里面的细节很良心了，虽然最后一,,,0回应
广,暂无评价,2021-09-29 09:36:06,观后感-随记,一开始看还好后面剧情没啥新意。按部就班的发展。玻璃那关真的很没意思只是单纯的概率，最后一关直接肉搏了。男主的人设很奇怪明明是个街溜子却有一颗圣母心，你tm都沦落到啥地步了，还装圣母就很突兀。印度阿三的人设也没新意，从一开始给他车费的时候就猜到了会被男二坑死，,,,0回应
Jasmine爱港剧,力荐,2021-09-29 09:35:24,好看，惊险刺激,看完还是很不错的，游戏环节很惊险刺激，对利益面前人性的刻画也比较深刻。最后不知道警察是不是真的死了，感觉哥哥故意没打他要害，不知道是不是有什么伏笔。特别记得被枪杀的正方形，摘下头套的一瞬间，我就被迷住了，太帅了，就出现一分钟就被无情地枪杀了，导演你怎么舍得,1,,0回应
小吴~,推荐,2021-09-29 09:34:41,鱿鱼游戏,很喜欢这部剧很紧凑的节奏，就是一个一个情节往前走，没有多余的一点拖沓，很爽，想让人一口气看完。事实上我也的确花了半天把看完了。孔刘很帅，画面很好，我很喜欢那个粉色蓝色的台阶和他们每个游戏的布景，明明是那么美好，明明做的是快乐童年做的游戏，但面临的却是生死挑,1,,3回应
李白白白白白白,很差,2021-09-29 08:04:29,啥傻X白莲花FW男主,男二这种我就是想赢、头脑好、身体强、心也狠、目标坚定、还有点小良心的人能活到最后才正常吧。没赢就没赢吧，自己自杀去让男主获得了奖金，跟男主说照顾好自己妈，然后呢？男主颓废了一年没管人家，老太太对他一家子也不错，你拿了奖金别说给多给少吧，把人安置好再颓废不行,,2,1回应
果子我是丸子,推荐,2021-09-28 23:40:44,一晚上刷完了鱿鱼游戏,一晚上刷完了鱿鱼游戏。感受就是，游戏很华丽，虽然有常规套路能猜到，但节奏气氛渲染挺好，不愧几大影帝聚集演技没的说，另外两个小姐姐真的吼有感觉！！最让我心软的就是他们俩了，女孩子就是柔软的存在！！视觉上对比强烈是这剧一大特点，糖果粘上血迹，枪支里开出花，美,,,0回应
不悔,推荐,2021-09-29 02:44:36,个人感受,值得推荐，不知道为啥，看到很多人在骂男主，我反倒觉得挺合理的，剧情非常连贯，节奏很快，但是我不知道为什么一开始就猜出那个负责人是警察哥哥了。而且在七八集最后一个游戏开始前有点审美疲劳，想要快进，但是最后男主敲门时女主被男二杀了，突然让我精神起来，慢慢又是高,,,0回应
传媒樱桃派,还行,2021-09-28 22:40:27,低配版的废柴男主值得全网夸吗？,说起当下热度最高的剧集，莫过于频繁上热搜的韩剧《鱿鱼游戏》。刚刚播完的第一季就引发全网热议，可就在9月28日，本片的导演却向媒体表示，《鱿鱼游戏》的第二季暂时不会拍摄，因为拍摄第一季时他就已经累到掉了六颗牙。不得不说，拥有李政宰、孔刘、李秉宪三位男演员同台飙,,2,0回应
Ashely,推荐,2021-09-29 02:15:30,命运的馈赠早已标好了价格,在做选择时总是会先看到礼物的精美，而时常忽略它背后所付出代价。明明经历过了第一轮游戏的残忍，却还是有那么多人选择回归游戏，不知是真的因为现实日子太难过没法忍还是奖金的诱惑太大不想忍？有点好奇456经历过这一切回到之前重新选择是否还会选择继续游戏？然后其实个人觉,,,0回应
变秃变强,推荐,2021-09-29 02:10:08,随便聊聊,被推荐了这部剧挺火的剧，用了3天里的空闲时间看完了。随便聊聊以下涉及剧透整部剧游戏部分BUG不少，房间的壁画那么明显他们眼瞎到看不见。第二关结束晚上休息期间所有人乱杀就因为老爷子几句话就都被感化了？踩玻璃环节就不能躺着滚过去？或者把背心绑一起做流星锤或者绳子,1,,2回应
嗯。啊,还行,2021-09-28 23:32:35,算数题，人数问题,双人弹珠39人。1个落单，剩下的淘汰一半。剩20人。剧里显示剩19？？玻璃桥选号码只有16个？？谁能解释一下紫薯布丁紫薯布丁紫薯布丁紫薯布丁紫薯布丁紫薯布丁紫薯布丁紫薯布丁紫薯布丁紫薯布丁紫薯布丁紫薯布丁紫薯布丁紫薯布丁紫薯布丁紫薯布丁紫薯布丁紫薯布丁紫薯布,,1,8回应
🐷🐷,力荐,2021-09-28 23:20:27,鱿鱼游戏,韩剧真的好善于发掘人性的善与恶。成奇勋和朴尚佑的赌徒心理，将自己和家人陷于债台高筑的困境，虽然他们文化教育差别人大，其实本质并没有太大的区别。让我难忘的。奇勋妈妈糖尿病并发症，没钱治疗的绝望哭诉。到了人生最后的尽头，还在为房租，为温饱努力。每一次好不容易,1,,0回应
将军令,力荐,2021-09-28 23:15:52,致喷子的一封信,真不知道给低分是为了黑而黑的，黑的点每一个在点上。说男主开局啃老废物到后面圣母，不就是作者想表达男主在经过一系列事情后，良知发现，结尾和老爷子打赌不也首尾呼应了吗！第二点说躺赢上去的，最后一句依旧是靠敌人送人头，这不也是证明了男主废物没能力，能走到最后一关,,,1回应
woooooooo,暂无评价,2021-09-28 23:12:04,尼玛那么多个vip面具里面就中国最明显，中山装还有杜甫诗,咋不让日本鬼子穿个和服，全场就唯独中国人能被认出来！这还不是黑是什么！还要黑我们杜甫剧情实在一般般吧，韩国片就是讲讲人性，老套路的东西，拍摄手法也是挺老套。谁要死全能猜中。要说亮点，就是这些游戏的变态程度刷新下限。男主太伪善了，一会儿正义感爆发去指责别人,1,1,5回应
六六爱看剧,推荐,2021-09-28 22:59:36,一二三木头人，,韩剧是我的下饭剧，看这个剧一点也不下饭，但还是眯着眼看完了。整体感觉挺血腥的，没看后面时没有一点人性，看到结尾还是有点人性的。资本家的游戏玩的可真大啊，还好不是在小时侯看，要不就成童年阴影了～游戏明明就带有很好童年回忆的～最刺激的部分还是第一关游戏，在无剧,,,0回应
RitaBaek,推荐,2021-09-28 22:25:21,鱿鱼游戏，符号游戏世界,鱿鱼游戏熔炉导演的新作+孔侑客串+网飞这样的元素很难不让人不一口气看完。预告很像网飞另一部《弥留之国的爱丽丝》故事参杂着同类题材饥饿游戏，大逃杀，赌博默示录……但也是同样的问题开始庞大的世界观在后续的故事里逐渐崩塌。吸睛点：精致的游戏布景天马行空的彩,,,0回应
kukusyaoran,力荐,2021-09-28 20:41:00,你我活在一场游戏中,看到很多评论在讨论人性什么的，说像男主这样伪善的人为何会活下来。人之所以为人，是因为他有选择的权力，但在社会达尔文里，没有“人”的存在。首先个体会因为自己的经历改变他的认知，如果把视角放回剧中，如果400多个人死在你面前，唯独只有你活下来。男主一开始想要钱就是,1,,3回应
塑料大马司,推荐,2021-09-28 20:13:05,缺少多巴胺的狂欢,三星半吧。剧本实在太平庸了，真的就如最后老板说的那样，有钱没钱到最后都毫无乐趣。我国法律是不允许人放弃自己的。一旦人拥有了放弃自己的自由，就会造成强者对弱者的剥削，比如片中说的那样“他们都是自愿回来的”。所以看到开头那张放弃自己的合同，我就已经对这部片子,1,,0回应
喵,推荐,2021-09-28 19:59:46,感觉男主母子好自私,四星给男主演技，即使人设很费，看得人一头雾水。也给孔刘的帅脸，可以说非常之性感。可吐槽的点太多了，没什么好说的。只说一点小想法，看的时候就很费解，男主母子不是太自私了吗？男主妈明明知道自己儿子什么货色，知道自己命不久矣，还鼓动自己儿子抢孩子。难道让孩子去美,1,,3回应
Momo,推荐,2021-09-28 19:01:10,近几年挺喜欢的一部大逃杀,许多人说鱿鱼游戏是很多电视剧和电影的影子，也许是我没有看过多少电影电视剧，所以更能单纯的观看这部剧集，而不是拿它和类似的电视剧作比较。剧情是有一些不合理的，比如男主一个既不是武力值最高，也不是最聪明，还表面善良实则也是踩着别人的尸体通关的人为什么能独自走到,,,0回应
lbb,很差,2021-09-26 11:50:11,有些剧就是纯粹在恶心人,看这部剧时，我想到了饥饿游戏，两者异曲同工，但这部剧就更加无底线。总觉得现在的剧作家难道是前人把所有的路都给走过了，ta想走新的路，只能不断去试探观众的底线么?我也在想，究竟是怎样浮躁无感的世界，才需要这样的剧作来刺激麻痹的神经。当你看到《印度的女儿》时，,1,1,2回应
LIANG,暂无评价,2021-09-27 14:08:32,极致利己主义与现实生活压力,看到大家都写了很多了，我想着重说一下男二号。之前看到一篇影评，说男二最后的自杀比较突兀，和男主的情感建立太突然了。但是这里我有着相反的看法，我认为男二最后的自杀是歇斯底里的，表达了一个普通人对生活的绝望。咱们先带入男二的视角看一下，假如你是男二，首尔大学,1,,1回应
MiaoSir,推荐,2021-09-26 22:43:43,鱿鱼游戏：一个黑暗、反转和讽刺的生存游戏,以下内容转载至微信公众号「缪博士的日常」(微信ID：miaosw1989)鱿鱼游戏SquidGame韩国2021.9.17鱿鱼游戏是Netfix上播出的生存游戏类惊悚剧集。剧中，成奇勋「李政宰饰，下称老成」是个债务缠身、失业离异、嗜赌成性的中年人，可以说工作、事业和家庭全失败。仅凭老,,,0回应
玫友人,推荐,2021-09-26 23:41:16,偶然参加了一个本剧讨论会。,写都写缟子了，就直接发个影评吧。首先这个片子和其他大逃杀类型的不同就在于它多了一条幕主事的人的线，感觉并没有讲得太好，但这条线也是服务于主线的，因为那个警察的哥哥也是之前的获胜者嘛，就暗示了就算获胜最后也还是被困在这游戏中.然后就是这个片子里的所有游戏就是,1,,0回应
rabbitccccc,暂无评价,2021-09-28 17:05:06,【涉及剧透】关于幕后boss的一些线索,【涉及剧透慎点】剧情比较紧凑刺激，中间也穿插了些许温情，在看到人性丑陋的同时，丁点的善意仿佛都在闪闪发光。个人觉得幕后boss可以再隐藏得深一点就更好了，从第2、3集开始基本可以推敲出boss，每一集都有相应的线索去证明这个推敲。例如从大家开始自相残杀的那晚，老头,,,2回应
小侦探百香果,还行,2021-09-28 16:34:52,《鱿鱼游戏》,就冲着李政宰来看看！第一集结束：还行。第二、三集结束：表达得有点刻意，但是一号老爷子却是个亮眼的人物形象。莫名有点想去当这部剧的群演，想象一下一群成年人一起做孩子们玩的游戏，有点奇异也有点开心。第四集：自相残杀是最残忍的，近在身边的隐患是最危险的。团队游,,,0回应
新雪野,暂无评价,2021-09-28 15:34:35,一点记录,才意识到我情感上能追完它，一是因为全程三倍速，二是因为警察那条悬疑线（是的，对我来说真相就这么重要，包括他刺入体制这件事也挺刺激的）从主线来说，它好中规中矩，对人性的塑造比较浅层，游戏又有点太综艺了，少质感。虽然节奏真的很好，也很工业化，但没那么值得琢磨。,,,0回应
水曜日的猫,力荐,2021-09-28 15:27:39,第一集《123木头人》小人物的开篇,一部剧，一个人说好，听了介绍有点兴趣，身边两个人，三个人都说好，那我也跟风来看看。在抖音上也刷到过一两个片段，知道是李政宰演的，还以为是精英人设。开篇，偷妈妈银行卡，赌博，被追债。感叹，演技派大佬什么都信手拈来啊。第一集看下来，剧情不拖沓，人物性格交代完毕,,,0回应
春水煮茶,暂无评价,2021-09-28 14:50:19,鱿鱼,男主进去游戏之前不知道最后只会剩下一个人吗？难道他以为可以好多人平分那些钱吗？就算可以好多人平分，另外的人也得死。那个老人在便利店门口出现在男主眼前的时候，就很不对劲，是大boss多少有点好猜。最后的游戏可以自己下去救人不？奖金一分钱没动，真的能过以前的生活,,,0回应
R K O,暂无评价,2021-09-28 13:41:20,开始就是终结就是开始…………,Thebeginningistheendisthebeginning………………最近火爆全网的鱿鱼游戏，刚开始看觉得故事情节设定有起因有经过，男主成奇勋47岁，因为公司裁员成了自由职业者，之后经营炸鸡店和小吃店全都失败，目前是做代驾，完全没看出来，如果有这份工作也不至于在女儿生日连吃,,,0回应
Ms. Liz,力荐,2021-09-28 11:44:41,分享与爱,演着最残忍暴戾的游戏，讲述着最动人俗气的温情。看了只剩下最后两集，最感动我的应该和大多数人一样，就是同伴们去世的那一集。除去被剧透的有些心理准备，绷不住的是自己从容认输的姑娘，她一句你比我更有活下去的理由真的让我瞬间破防了。人活着，发现最后最有意义的，不外,1,,0回应
Dumb,暂无评价,2021-09-28 11:30:53,001,花了一个周末，一口气看完squidgame，我思考良多。这无疑是我近几年看过最好的韩国电视剧。精良的韩国电影不少，而电视剧往往以量取胜，以偶像为噱头。所以当《鱿鱼游戏》以网飞排名第一的标题推荐给我，我的确被它惊到！这是一部大牌为客串，非一线演员为主角的人性大戏。小,,,0回应
我就是个大天才,暂无评价,2021-09-28 10:57:24,鱿鱼游戏观后感,昨天看完了鱿鱼游戏，总体来说这是一部食之无味弃之可惜(食之无味有点太严重了，毕竟前几集是悬疑感血腥感拉满，别问我为什么说食之无味，问就是显得通畅)。鱿鱼游戏前面几集大概是立主角人设，游戏布局，观感就是：哦哦哦，我就知道是个杀人游戏，啊啊啊啊啊，他屎了，哇哇哇,,,0回应
小小王2.0,推荐,2021-09-28 10:45:53,《鱿鱼游戏》的游戏之外,不得不说，《鱿鱼游戏》真的又刺激，又残酷。谈谈几点零散的感想吧：1.游戏本身先从技术层面来看，后面再从隐喻层面分析一下。关于大Boss如果只满足于从游戏本身去看这个BOSS的话，可能会觉得结尾挺惊艳的，就是那种原来是他的感觉，类似于《电锯惊魂1》最后那个场景。其实,8,,0回应
一只醉虾,暂无评价,2021-09-28 09:46:59,在主角塑造方面,看完鱿鱼游戏，感觉这部片子在游戏设置上很一般，制作也比不上动物世界，动物世界那个场地制作是真帅呀。相反很多人吐槽主角圣母，但是我觉得，他的主角塑造要远好于动物世界。同是用世界的残酷和角色心中的善产生强烈对比的剧，在塑造角色最关键一点是，一定不能让正面主角的,,,0回应
余光的余光,力荐,2021-09-26 10:30:03,一些感想,昨天熬到将近四点看完的，真的一口气看完，欲罢不能。血腥与暴力画面还在我视觉可接受范围之内，那个帅帅的韩国警察和28号去运器官的时候我就在猜那个负责人是不是这个韩国警察的哥哥，结果最后还真是，只是不明白他为什么把自己的弟弟杀了。弹弹珠那里有些冗长，但也特别好,,,1回应
风满洛城,力荐,2021-09-26 00:49:02,金钱与人,晚上一口气看完了所有，角色选择很有意思，一群生活中的失意者，生活在社会底层，可以说有这不同的原因或者背景需要钱。有看似双门洞的骄傲实则债台高筑的“精英”尚佑，有社会底层离婚母亲生病的混混，有逃到韩国的脱北者当扒手的姜晓，还有诈骗犯韩美女，失去母亲亲自杀死自,,,0回应
大海软胶囊,推荐,2021-09-28 01:31:26,鱿鱼游戏 它凭什么火？,鱿鱼游戏的火爆绝对不是偶然微博上有人说鱿鱼游戏靠的是营销买热搜据我所知在中国除非翻墙就特么登不上网飞演员导演根本没有来中国做过相关宣传连续登上热搜几天是大众积累的结果因为我本人一天也搜个5次左右一部好的剧集不仅仅看的是剧情国内也有类似剧情的电影《动,,,0回应
豆友q4fnZub9DU,推荐,2021-09-28 02:28:05,不吐不快,剧是好剧只是看完最后一集感觉如骨鲠在喉不吐不快男主是不知道最后只能存活一个人吗？难道他想的是最后三个人都能活下来拿到钱离开吗？我委实不清楚最后他的愤怒从何而来他是个痞子无赖但还存有底线觉得不能滥杀无辜为了自己活命拔河杀人为了活命欺骗老头拿到玻璃球我都,1,,0回应
廿五十七,推荐,2021-09-28 01:03:22,忘记吐槽的一个点：其实宿舍墙的画已经剧透了游戏内容,其实到最后三个人的时候，我才发现墙上的画，正好是所有的游戏，我不信邪，反过头去看了前几集，最少在第五集就能看到墙上隐隐约约的图案了，这些人就真的都这么笨，不往周围看看吗？不思考一下吗，第五集都玩了好几关了，不考虑一下吗真的雾里吐槽，不仔细看都能看到至少三关,3,,1回应
杨冬至,推荐,2021-09-28 00:34:37,如果一个人时为了让自己活下去，那他做什么都是可以理解的。,好多人说烂尾，但我觉得还好，这部剧的精彩程度是毋庸置疑的，好多人看了怎么怎么生气，我觉得是他们把男主当成好人了，但是他本来就是赌鬼、酒鬼，本来就是个人渣啊，并且在他妈妈急需手术的时候，他为了自己的尊严没有接受前妻丈夫的钱，反而要去参加游戏，他不知道这就是个,,,0回应
等1个人咖啡,暂无评价,2021-09-28 00:18:24,值得更高分的情感人性好剧,个人感觉第二喜欢的韩剧了（第一永远是请回答1988）。从一开始还没播出开始就挺期待的剧。(网飞出品必属精品！！！大声bb)演员演技在线，剧情在线，台词在线，细节在线，两位小姐姐的友情加最后鱿鱼游戏中的男二自杀还是很感动到我的。作为一个刚到大城市漂泊的打工仔，目前城,,,0回应
