comment_er,level,comment_time,caption,content,support,object,feedback
火影九王爷,推荐,2021-10-08 18:28:59,鱿鱼游戏,热剧：《鱿鱼游戏》最近，韩剧《鱿鱼游戏》大热，各大网络平台随处可见各种推荐。特别是其中涉及的一些游戏，诸如木头人、划糖饼等等，被人们津津乐道。花了两天零碎时间看了一遍，感觉还不错，挺新奇，有创意。而观剧所引发的思考也是深深的。概括如下：生死抉择面前，人类,,,0回应
华尔,推荐,2021-10-08 18:08:07,几场游戏对于社会的隐喻,仁者见仁，这里写的是一些直观感受，欢迎探讨。一、一二三木头人这个游戏象征着社会的基本法则——跟随大流，不轻易躺平也不轻易冒进，依据主流的规矩按部就班去做就能过关。随波逐流法则对社会的绝大多数阶层都有效，不需要什么特别的智慧和努力，出现意外的概率其实也不大,,,1回应
格格千岁,推荐,2021-10-08 17:34:30,男主人设真的烂吗？,男主让我觉得，世界人大多数都这样吧，半恶半善，其实有时候这样的人可能让人觉得最恶心，因为它把人性剖析地彻底。有人吐槽男主伪善，可如果是我们呢，你看到老爷爷尿裤子了，你不会帮他系上吗，你和老爷爷必须死一个的时候，你真的能慷慨赴死吗，马上就要死了的时候，你不会,2,1,0回应
Daniel,推荐,2021-10-04 10:52:08,人性，人生。 （严重剧透）,先捋一捋颜色、符号等。红色：体制内的人三角形：军队圆形：打工人矩形：管理者老头：体制内当下最后一任最高层李秉宪：新高层绿色运动服：体制外的底层人士那么，从第一个男主遇到的游戏说起吧。打画片：孔刘与男主代表了权贵与蝼蚁般的穷人二者本就不是一个量级,3,,0回应
ailuoxiaoyu,推荐,2021-10-08 16:47:42,观众和贵宾的微妙联系,就好像火车选择一样，铁轨一边是五个不听话的小孩，另一边是一个乖小孩，让你来选择操控手柄决定两边谁生谁死。这部剧就是在各种游戏中设计这些极端情况，通过参赛者来看人在极端情况下的反应和选择，让观众不能接受的主要是不拿人当人看这一点，如果换成动物，比如蚂蚁蟑螂之,,,0回应
后现代哥斯拉,还行,2021-10-08 16:21:25,游戏,很多人说这是一部关于人性的剧，其实就剧情本身而言没有给我带来更多的思考，一切对于我而言不过是自然而然地发生了，有人说人性真可怕这部剧真的是考验人性，那么这是假定人性是善的前提下发出的感慨，可是到底是“人之初性本善”还是“人之初性本恶”至今也没有一个统一的绝,,,0回应
Daniel,推荐,2021-10-04 02:03:00,代入了吗？你的人生。 （严重剧透）,先捋一捋颜色、符号等。红色：体制内的人三角形：军队圆形：打工人矩形：管理者老头：体制内当下最后一任最高层李秉宪：新高层绿色运动服：体制外的底层人士那么，从第一个男主遇到的游戏说起吧。打画片：孔刘与男主代表了权贵与蝼蚁般的穷人二者本就不是一个量级,1,,0回应
小烨,还行,2021-10-08 13:50:12,全球第一韩剧，你还没看吗？,最近全球最火的一部剧，非《鱿鱼游戏》莫属，它是Netflix首部登上全球第一排行榜的亚洲作品。即使有人没真正去追这部剧，但肯定也在刷微博、刷朋友圈、以及看新闻时，听说过这部剧的名字，微博上#鱿鱼游戏#这个话题已经突破了16亿阅读量，抖音上#鱿鱼游戏#话题下的视频也有50,1,,0回应
岁月神偷姜絮渺,很差,2021-10-08 13:56:48,我来打拳（没有反讽的意思，我觉得这拳该打）,刚看完第一集，剧集里传达的对女性的恶意透过屏幕让我气到浑身发抖。韩日不愧是恶臭女奴社会的代表。当第一局游戏结束，第一个跳出来哀求回家的是女性，接下来第二第三个跪地求饶的还是女性，第四个才是男性，在编剧眼里，女性都是软弱的，最先崩溃的一定是女性，而男性只不过,1,,0回应
对方正在输入...,暂无评价,2021-10-08 13:50:38,男主您配吗？,十一前社交媒体上到处推鱿鱼游戏，还有人说比网飞同类型的弥留之国的爱丽丝还好看。我一直喜欢弥留之国爱丽丝这种类型的片子，可惜没有很多。结果！我十一看完了鱿鱼游戏一头恼火。男主是个赌博对母亲女儿都很差的人渣，看到这虽然对这个男主的行为感到很气愤，但自我安慰先抑,2,,0回应
酥黑犟,推荐,2021-10-01 08:43:53,《鱿鱼游戏》&《动物世界》不能说像，只能说有点不一样！,最近韩国的电视剧《鱿鱼游戏》火爆全球，成为打破网飞新记录的存在！为了踩住热点，于是我就一口气狠狠刷完了这部剧，也出了一篇文章，写完之后对它依旧念念不忘，辗转反侧。于是在朋友的推荐下，看了类似题材的电影：《动物世界》看完以后，发现两部在构架上其实并没有特别,,,0回应
。,暂无评价,2021-10-08 13:07:29,在网上看到一个视频，关于鱿鱼游戏2的，比较有意思，大家可以看看,看了鱿鱼游戏之后，前几集看着心情就像做过山车一样，最后结局确实不是很好，不少人都挺期待鱿鱼游戏2，在网上看到一个视频，关于鱿鱼游戏2的，挺有意思得，大家可以看看。你们觉得鱿鱼游戏2会新增加哪些游戏项目[鱿鱼游戏2，你觉得会新增哪些游戏项目？@西瓜视频创作中心-,,,0回应
南一葉,还行,2021-10-08 13:07:27,韩剧的通病，高开低走，想讨论人性结果只在人性表面匆匆略过,文宣做的太好，再加上很喜欢这种题材所以抱着十二分的期待。其实一开始的人物设定还可以，现实社会的最底层人物徘徊在人生深渊的悬崖，无法在生活中看到一丝希望希望通过这种方式一夜暴富拯救自己的人生。前面几集的游戏也确实够血腥够暴力够刺激眼球，但和男主的人物设定实在,,,0回应
豆友5CEFACA320,推荐,2021-10-08 12:57:11,细思极恐的鱿鱼游戏：男主人设不是自相矛盾也不是烂尾，而是会演戏的影帝，真相原来有时也会触目惊心......,我总感觉男主才是最狡猾奸诈的人，只不过因为是男主所以必须头顶善良的光环示人，否则这部剧倡导的似乎就只剩黑暗而不留一丝光明了，但很多人给予他伪善的评价还是没错的。在我分析看来他其实是个很会演戏、伪装、善于收买人心、利用他人甚至能够将借刀杀人做到不着痕迹的狠人,3,,3回应
大费米,推荐,2021-10-08 12:09:51,短评写不下了，在这边随便写写,一到六集各方面都很惊艳，尤其是第六集，看完了让我一晚上都没缓过来那股子抑郁。但后面的剧情就实在不敢恭维了。。。一些小bug都可以理解，但男主这个主角光环就离谱，赢麻了之后还在那里装圣母（不排除这也是让观众体会人性的一种手段）。不说前面的几关，在第五关如果尚佑不,,,0回应
周锐,暂无评价,2021-10-08 11:51:06,久违的韩剧，这剧爆得理所当然,两天刷完了这个剧，看前无意看了一点剧透，知道有两个女生会很感人，也隐隐约约知道老头是大boss，也早猜到男主会赢到最后。全程带着这些心理预设看，精彩度、入戏度和惊喜度真的会大打折扣。整部剧节奏紧凑不拖拉，全员角色演技在线，让人看得爱恨交错，还有非常值得夸赞是这,,,0回应
Joseph.W,还行,2021-10-08 11:45:26,债务游戏,这电视剧能火起来大概率是因为故事背景暗合了08年金融危机一直到新冠肺炎肆虐的这十几年间实体经济发展乏力，民间投机思维和消费主义风潮盛行在世界范围内有大量的个人和企业破产或者因为各种原因背上自身根本无法偿还的债务电视网络和自媒体几乎每天都在报道这类新闻，本电,,,0回应
k.k,较差,2021-10-08 11:43:06,一个拼盘宴席，还有一道很不下饭的主菜。,逃生游戏类的影视作品，好不好看主要看游玩的过程，以及参与游戏的主角是否有相对应的魅力。鱿鱼游戏融梗拼盘就不说了，但最让我难以下饭的是男主的设定。赌徒也就算了，毕竟没点恶习也欠不了那么多钱，但能不能不要给这样的赌徒安排各种圣父情结，整个人物真的十分十分割裂,1,,0回应
盼望跟他见面,还行,2021-10-04 06:14:55,曹狗，你没有心！！,从爱丽丝那来的，貌似又得去看赌博默示录和听神明的话了哈哈哈，ok，fine，反正剧荒看完最想说的就是：曹🐶！你没有心！但凡没有背叛得那么惨烈只是利用什么的我都可以磕一口be美学啊呜呜呜，我的阿里我的光，一开始真的很能感受到他对他的特别（现在想来都是因为想拉拢一个,,,0回应
墨十七,较差,2021-10-06 10:03:12,这分这么高合理吗？,一口气刷完全集，这评分认真的吗？男主，家里老母体弱多病还兼职打点零工挣钱，自己大把时间却连个碗都不洗（估计其他家务也都是老母亲在做）。老母和女儿的生日都不记得却记得自己的生日，因为那是银行卡密码，那是赌狗的命。赌赢了一点钱还给前台妹子小费？你是不是忘记了家,3,,0回应
盼望跟他见面,还行,2021-10-06 14:07:18,曹?你没有心！！,总体三星半，因为曹🐶减半星看完爱丽丝来的，貌似又得去看赌博默示录了哈哈哈，ok，fine，反正剧荒看完最想说的就是：曹🐶！你没有心！但凡没有背叛得那么惨烈只是利用什么的我都可以磕一口be美学啊呜呜呜，我的阿li我的光，一开始真的很能感受到他对他的特别（现在想来,,,0回应
请回答1900,还行,2021-10-07 18:54:49,人性固恶，总有希望,很多人不喜欢最后一集，我还挺喜欢最后一集的安排的。于悲观处看见一丝希望，让人有继续前行的勇气。当男主一身潦倒地坐在地铁上时，可能没有人想到这个人有着456亿韩元的存款。地铁中的人都对他表示了嫌弃，但是银行行长却对他尊敬有加，因为他知道这个人的存款。这是很讽刺,,,0回应
唯我主义,还行,2021-09-30 22:45:28,作为生存游戏类影视剧，它不刺激也不烧脑，只让人觉得好笑,一、总结一下好笑的点：1.主角脸谱化，极好笑又单薄的人设。一个窝囊废、啃老族、赌徒，是游戏通关的胜利者诶，厉不厉害，反不反转，是不是体现出来人性好复杂，每个人都有两面性呢。实际上我只看到一个又笨又弱的大叔靠着导演编剧的金手指躺赢到了最后，哪怕你给点铺垫也好吧,2,,0回应
18号,暂无评价,2021-10-08 09:42:50,18号,一部鱿鱼游戏，展现了当代各个组群的生活方式，有人问“到底是命重要，还是钱重要”可能很多人会回答，命重要，但在生活中，我们经常会看到，为了钱不要命的人！跳楼讨薪，为钱放弃治疗疾病，还贷款疲劳驾驶，这些在生活中经常看到的真的是傻子吗？当然不是，因为命在解决不了,,,0回应
二师兄,暂无评价,2021-10-08 09:10:15,鱿鱼游戏感观,看了这个剧，最近感觉到世上最美的就是平凡人生命中的闪光点，到同时又感觉到人们都有太多无奈和苦难。2019年cpa考试后，我结束了长达5年的考证生涯…告别了那每天学到很晚，一点一滴时间都要去节省的日子。所以我决定给自己放个假，去看点自己感兴趣的书，让心灵自由的流浪一,1,,0回应
城市浪漫养猪者,推荐,2021-10-02 23:49:30,简单游戏，复杂人性---《鱿鱼游戏》,很久没有如此认真地追一部剧，虽然充满各种说是抄袭大杂烩的评论，但我之前似乎没看过这种剧。前几集剧情确实还不错，每一集的游戏都蛮紧张的，主角演技也都还不错。但到后边感觉稍微有点烂尾，但也再次体现了人性的复杂程度。简单说下自己的感受。1、人性电影里的弱势角色,1,,5回应
燚见电影,暂无评价,2021-10-08 08:32:01,毁誉参半的成人游戏，杀疯了,该说不说，我这个「大尺度」也许和你心中所想，并不一样。在娱乐圈遍地都是「大尺度」的当下，早已没有「最大」，只有「更大」。而我只是一个爱看电影的创业者，不爱八卦，只聊感想。如果你看过《大逃杀》系列电影的话，你大概率不会讨厌《鱿鱼游戏》。它们的核心主题都是,,,0回应
three.ten KE,还行,2021-10-08 08:25:34,意义,看了几篇文评，中心思想差不离是讲【人性胜利论】，也有说不是，立意搞更大。依我看，这片就告诉你一个道理:别碰赌。一个有人性的人，在赌里就会丧失人性。为了证明这个立意，几个故事分段逐层递进告诉你，男主买马时花的是母亲的钱，男主玩玻璃球时杀的是自己认识的老友。,,,0回应
╰堇花°凋零时ޓ°,很差,2021-10-08 08:10:55,全员智商不在线（剧透鞋底）,斗智，生存类游戏类型。这显然是生存类而非斗智。但是这两者之间都有个共同点，就是高智商。不然你凭什么活到最后？靠运气？赌徒和赌场boss交锋靠运气？男主靠主角光环活到最后，这角色在剧中没有起到任何作用。首先没有高智商让自己存活，第二没有梦能力帮助自己想帮助的人。,5,,3回应
MungBean,暂无评价,2021-10-08 03:07:54,我觉得结尾很拖拉，然后呢？,作为一部营销号狂炒、据说在国外爆火、国内几派人马争论不休的韩国文化输出性代表剧集，我本着没有调查就没有发言权的原则，花一天的时间对其进行了浏览。但是我想说的东西，既不是对人物情节的解析，也不是对情节结构的批判，作为一个人，和在太阳照耀下的地球上亿万万人一样,,,0回应
小叮当,暂无评价,2021-10-08 02:52:38,就想看孔叔和李子成玩游戏行不，最好叫上丁青,为啥非要纠结谁最后赢？赢家只有那群衣冠禽兽，患有穷病的全是输家。在韩国这种jieji高度僵化的社会里。普通人谈什么人权，只不过是财团手中的筹码和玩偶。人性本来就是在所谓的恶与善之间游离。极恶极善往往少，在中间当墙头草的是大多数，赌狗主角，蠢且坏没什么可说的，但,,,0回应
松松odile,暂无评价,2021-10-08 00:11:32,人性的弱点,事情不是非黑即白的。这部剧只适合有同理心的观众，因为它本就不是一部爽剧。展示了底层的穷苦，人性的弱点。其实很多人不喜欢也挺好，是不是可以侧面相信这些人相信人间真善美，既然男主必须无所不能，那自己在生活中是不是也得做到十全十美，哈哈。其实我更倾向于男主是没,,,0回应
心路飞扬,推荐,2021-10-05 20:53:12,惊悚过关类斗智片。一帮生活落魄者被运到一个孤岛进行游戏，游戏失败的代价就是死，赢的游戏的人有望取得高昂的奖金，是选择自由地去过糟糕无望的生活，还是被迫参加拿生命做代价的游戏，大家将何去何从,鱿鱼游戏第1—4集印象：惊悚过关类斗智片。一帮生活落魄者被运到一个孤岛进行游戏，游戏失败的代价就是死，赢的游戏的人有望取得高昂的奖金，是选择自由地去过糟糕无望的生活，还是被迫参加拿生命做代价的游戏，大家将何去何从？这个游戏的组织者又是什么目的？大家拭目以待。,,,0回应
一支笔,暂无评价,2021-10-07 23:26:34,关于男主角的一些反思,看到很多人觉得男主伪善，圣人,,,0回应
冉峰,力荐,2021-10-07 23:18:19,短评字数超了，只好来到这里,知乎上很多大神分析的非常全面且深入，顿感自己的词汇和眼界极为有限，但我还是想掰扯两句毕竟是认真看过也是真的喜欢。男一，老好人，开局做了很多令人非常反感的事情，但是主角光环，后续的人性开始发光。但我却一直喜欢不起来，可能是首因效应或者是为了发光而发光得太过牵,,,0回应
WWW,暂无评价,2021-10-07 23:09:22,鱿鱼游戏打动我的地方其实是男主人设的带入感,鱿鱼游戏能火起来一点也不奇怪，节奏紧凑流畅，剧情并不复杂，演员表现很有张力，看完就是一个爽字。以一个几乎刷遍知名无限流小说的人的视角来看，剧情确实非常简单而且套路。但是它真正打动我的，是简单粗暴的剧情中透露出的赤裸裸的人性。看之前我就有看到各种关于男主圣,,,0回应
小白杨,还行,2021-10-07 22:19:48,感觉没有想象中的那么惊艳,说几点自己的感受吧。•首先剧中人物的演技都不错，还是在线的。•男主前几集的表现很迷，明明现实生活悲惨，被人追债，签下放弃身体保证书，老妈病重，可谓穷途末路。在游戏里看到那么多人惨死却一直嘻嘻哈哈，像是在度假的表情，非常出戏。明明紧张的生死选择，,1,,0回应
三音风子,推荐,2021-10-07 21:27:26,《鱿鱼游戏》的游戏规则,Netflix出品的韩剧《鱿鱼游戏》大爆，男主角李政宰再上一层楼，首次出演电视剧的女主角郑浩妍则在一夜之间拥趸无数，顶级代言在手，当然这是一部群像剧。都说大红靠命，红是一种玄学。但玄学也是门学问，能够成为现象级作品，《鱿鱼游戏》一定做对了什么。《鱿鱼游戏》的逻辑,,,0回应
醒,推荐,2021-10-07 21:18:12,鱿鱼,一开始以为是欢喜游戏剧，打开后发现血腥、残暴。是，我抱着不能总站在自己的角度去看待事物的角度看完了整部剧。那些真正经历绝望人生的人，他们的痛苦是我无法轻易承受和理解的。在剧中，有几幕是有所能悟的。第一幕，吴成勋被打得遍体鳞伤的时候，借钱买的鱼，分给了流浪猫,,,0回应
犹豫就会败北,还行,2021-10-07 21:12:31,大概是八十五分,八十分给整体水平，五分给少见题材。喜欢的细节：开始游戏之前打纸片，十万和扇巴掌，结果就十万完全赌性激发，扇不醒。猪猪存钱罐总是金光闪闪！拔河比赛成功以后每个人脸上的表情都很值得玩味。最后染了个红头发。第一次投票结束游戏然后几乎都返场了也蛮人性化的。男,,,0回应
樱玦,还行,2021-10-07 21:11:43,不要露出你的獠牙。,就写警察小哥千里寻哥和姐妹线。国庆最后一天看完了这部剧，最喜欢看警察小哥线，好喜欢小哥！警察不过给个人设，警察小哥为了找亲哥哥完全不顾职业操守，打死那么多人，下手那叫一个干净利落。一路杀人取衣服换装，把整个游戏内部暗箱操作搞得明明白白的。反观男主那边，除,1,,0回应
一罐秋,推荐,2021-10-07 20:55:36,杂,背景-渲染，不得不，只能说欲扬先抑-不好意思我想歪了，隐喻-发声，弱肉强食，展现，如何打拳-领头羊与压轴戏-挑拨离间，有趣的28号，与虎谋皮，公平，警报-对手，欺骗，背叛出现善良，非主角，情理之中，温情的花朵，只在残酷中盛开，老先生串起这一集的线，善恶只等最后分晓,,,0回应
小哥,力荐,2021-10-07 20:45:51,猜到了结局但还是很惊喜,其实吴一南是最终boss很容易猜。第一，这种游戏一般是缺钱的才会来玩，老年人来和年轻人玩游戏基本是白给，所以整部剧只有一个老人参赛，而且就算赢了钱，那么大岁数了要那么多钱有什么用呢。这里我就产生了这个老年人不一般的想法。但极端点说，说不定有闲得慌的老人就想来玩,1,,0回应
豆友207496085,暂无评价,2021-10-07 20:27:10,伪善男主,玩弹珠那集老头一直对他很好不是吗？他还是骗了老头让老头去死，结果玻璃桥男二帮他们三活下来了并且做的事其实跟他一个性质，结果他去指责男二。伪善哈哈哈哈哈哈斤斤计较经济斤斤计较斤斤计较斤斤计较斤斤计较斤斤计较吧哈哈哈斤斤计较经济斤斤计较斤斤计较斤斤计较斤斤计较,,,1回应
卓人羽,暂无评价,2021-10-07 20:23:11,气活竖锯的开司与没拍好的路西法效应,为了不被剧透所以花时间看完了。咋说呢……一言难尽，本来想随便写几句，短评又放不下了。胡乱凑了个标题，想到哪儿写到哪儿。首先就是这个游戏机制本身的设计问题。处死偷器官的红衣NPC时候黑衣强调了他们游戏的主旨是公平，并且后面强调了好几次，然而有的游戏就属于在《电,,,0回应
秣陵春晓,还行,2021-10-07 17:32:54,要素过多到适得其反的大逃杀电影- -,刚开始看《鱿鱼游戏》的时候会有眼前一亮的感觉，从孔刘在车站打人耳光那段开始就笑料不断。充满血腥味的杀人场景和幼稚园风格的少女心配色形成了鲜明的反差，再配上古典音乐，确实有那味儿了。不得不说开头几集的“一二三木头人”和椪糖游戏确实有意思，也是全网热议的爆点，,,,0回应
丁香美剧,推荐,2021-10-07 16:08:17,一夜屠榜，这部十九禁新剧「杀疯了」,如果有这么一场比赛，玩的都是熟悉得不能再熟悉的童年游戏，123木头人、拔河、弹珠…赢了就能得到一笔巨款。你会不会参加？那么，如果条件是拿命去赌呢？没错，今天我们要说的就是最近刷屏的——《鱿鱼游戏》오징어게임网飞出品。目前位居NetflixTVshow世,,,0回应
frwef,推荐,2021-10-07 15:49:18,我认为男士的人设并没有问题,很多人觉得男主人设相悖，他对他人比对亲人显得友善，但现实也是如此，有些人人对朋友或许会比对父母亲人好很多。而面对那些杀人场景，大部分人都会腿软发抖，代入一下或许你不会比人家好，或许还会被同化为杀害别人换取自己利益的那类。电视剧把这些放大了，换做现实应该是故,3,,0回应
开热水,力荐,2021-10-07 15:47:21,让一个幽灵重新在全世界游荡,这部电视剧反应了当今这个资本主义社会的方方面面，全面的评价就不说了，只说其中的一点其实我们来到了一线城市，在资本家的公司里996打工，不就是在玩这么一场鱿鱼游戏吗玩赢了，一线城市买房安居，可以获得了做个人的资格玩输了，身体健康心理健康通通丧失，只不过是电视,1,,0回应
怪我喽,暂无评价,2021-10-07 15:24:45,老头子 你还真是藏的深,老头子，我看错你了，原本以为你就是一个单纯+可爱的小老头，可最后你却这样。为了回忆年少无知的时光，你还真是玩的大。奇勋的内心看来造成了极大的阴影，原本想从头开始，染了个非主流色，可内心却无法忘记游戏给他带来的这一切。那么多人死了，最后只要大叔一人活着，为什,1,,0回应
寸,推荐,2021-10-07 14:37:09,【鱿鱼游戏】追剧日记·317,2021.10.02之前听说过，朋友在看，有点想看。晚上看完解说。人性之恶深不见底啊……钱多了也会枯燥2021.10.02孔叔抽男主巴掌咋那么有喜感hhh2021.10.04小孩的游戏这么玩真吓人…小警察混进来也太容易了，他们这系统也没个识别之类的，漏洞挺大。男主典型老好人而且最贴近,,,0回应
叶不羞呀,推荐,2021-10-07 14:37:00,人性不可考验,微博上风评太好，看了没有达到预期吧。出发点应该是人性的考察，但是感觉没有表达的很好，导致男主人设和男二人设没有保持一直的统一。一个只知道赌博的把自己妈妈的存款都拿去赌博的人，对别人却是大方的不行。好像没有涉及到自己的利益的时候就表现的无比善良。就像对001,,,0回应
walking玎,推荐,2021-10-07 14:25:48,一二三，木头人,要命版的男生女生向前冲。降低游戏的难度，使得我们觉得终于有能看懂闯关题目时，才是大戏开场。一个在社会中最让人不齿的烂赌成性的人渣，在游戏中，不但是善良正义乐观的化身（对比其他人），还成为了内定保送生，一路拱手送晋级。其中每一场游戏，看到的就好像是利益、危机,,,0回应
晒太阳,暂无评价,2021-10-07 14:23:56,最后两集减两星,看完最后一集，希望男二活下来是怎么回事。废材男一在去看女儿和对抗资本之间选择对抗，是什么给了他底气和勇气？编剧是梁静茹吗。最后一集槽点太多，前7集有bug，但对观感影响不是很大，最后2集编剧为了拉回三观，男一忽然改掉赌徒劣根，化身正义，观感开始跑偏，见到老爷子,,,0回应
PAGY,推荐,2021-10-07 14:03:45,人生即如遊戲，your special day is my everyday,遊戲裡有三種人，各有代表。這裡只集中討論遊戲參與者和VIP。VIP代表著社會金字塔塔尖的那些人。在對VIP們說話時，一直是使用英語，可是劇中有個細節就值得琢磨了。黑面具管理人對001在電話裡說，Iamgladtohearyouenjoythegame。001是韓國老人，在遊戲裡是說韓語，這,2,,1回应
